{
  "$schema": "https://json-schema.org/draft/2020-12/schema",
  "$id": "https://ask.legal/schemas/hk-case-semantic-content-case-result.schema.json",
  "title": "Hong Kong Case frozen semantic content expected result",
  "type": "object",
  "additionalProperties": false,
  "required": [
    "schema_id",
    "schema_version",
    "fixture_id",
    "result",
    "provider_calls_authorized",
    "workflow_admissions_created",
    "search_records_created",
    "release_eligible",
    "external_effects"
  ],
  "properties": {
    "schema_id": {
      "const": "asklegal.hk-cases.semantic-content-case-result"
    },
    "schema_version": {
      "const": "1.0.0"
    },
    "fixture_id": {
      "pattern": "^HKCASE-PROP-SEM-CNT-[0-9]{3}$"
    },
    "result": {
      "$schema": "https://json-schema.org/draft/2020-12/schema",
      "$id": "https://ask.legal/schemas/hk-case-semantic-content-result.schema.json",
      "title": "Hong Kong Case semantic content evaluator result",
      "type": "object",
      "additionalProperties": false,
      "required": [
        "schema_id",
        "schema_version",
        "rule_id",
        "request_fingerprint",
        "reference_map_fingerprint",
        "outcome",
        "reasons",
        "expected_candidate_count",
        "observed_candidate_count",
        "matched_candidate_count",
        "accepted_candidate_count",
        "quarantined_candidate_count",
        "complete_unit_count",
        "provider_calls_authorized",
        "workflow_admission_created",
        "search_records_created",
        "release_eligible",
        "external_effects"
      ],
      "properties": {
        "schema_id": {
          "const": "asklegal.hk-cases.semantic-content-evaluation-result"
        },
        "schema_version": {
          "const": "1.0.0"
        },
        "rule_id": {
          "const": "HKCASE-PROP-SEM-CONTENT-EVALUATOR-001"
        },
        "request_fingerprint": {
          "type": "string",
          "pattern": "^sha256:[0-9a-f]{64}$"
        },
        "reference_map_fingerprint": {
          "type": "string",
          "pattern": "^sha256:[0-9a-f]{64}$"
        },
        "outcome": {
          "enum": [
            "EVALUATOR_BLOCKED",
            "FAIL",
            "PASS"
          ]
        },
        "reasons": {
          "type": "array",
          "minItems": 1,
          "items": {
            "enum": [
              "CANDIDATE_INVENTORY_MISMATCH",
              "CONTENT_MISMATCH",
              "DEPENDENCY_MISMATCH",
              "DISPOSITION_MISMATCH",
              "EVALUATION_LEAKAGE",
              "EVIDENCE_MISMATCH",
              "MEANING_MISMATCH",
              "OBSERVATION_BINDING_INVALID",
              "PASS",
              "QUOTATION_MISMATCH",
              "REFERENCE_BLOCKED",
              "REFERENCE_INVALID",
              "RESOLUTION_MISMATCH",
              "SELECTION_MISMATCH",
              "STATEMENT_STATE_MISMATCH",
              "UNIT_ACCOUNTING_MISMATCH"
            ]
          }
        },
        "expected_candidate_count": {
          "type": "integer",
          "minimum": 0
        },
        "observed_candidate_count": {
          "type": "integer",
          "minimum": 0
        },
        "matched_candidate_count": {
          "type": "integer",
          "minimum": 0
        },
        "accepted_candidate_count": {
          "type": "integer",
          "minimum": 0
        },
        "quarantined_candidate_count": {
          "type": "integer",
          "minimum": 0
        },
        "complete_unit_count": {
          "type": "integer",
          "minimum": 0
        },
        "provider_calls_authorized": {
          "const": 0
        },
        "workflow_admission_created": {
          "const": false
        },
        "search_records_created": {
          "const": 0
        },
        "release_eligible": {
          "const": false
        },
        "external_effects": {
          "const": "NONE"
        }
      }
    },
    "provider_calls_authorized": {
      "const": 0
    },
    "workflow_admissions_created": {
      "const": 0
    },
    "search_records_created": {
      "const": 0
    },
    "release_eligible": {
      "const": false
    },
    "external_effects": {
      "const": "NONE"
    }
  }
}
