{
  "schema_id": "asklegal.hk-cases.semantic-content-case-result",
  "schema_version": "1.0.0",
  "fixture_id": "HKCASE-PROP-SEM-CNT-016",
  "result": {
    "schema_id": "asklegal.hk-cases.semantic-content-evaluation-result",
    "schema_version": "1.0.0",
    "rule_id": "HKCASE-PROP-SEM-CONTENT-EVALUATOR-001",
    "request_fingerprint": "sha256:b0e3f22f9e691ba5fc489cdad85873e9d6c6a3c79b8b22aaafb1aa14adb2e1f8",
    "reference_map_fingerprint": "sha256:4a914ae9689d4c5c2b93cc07fef711d1ee9783b469d4078a3920699db7b6dab6",
    "outcome": "PASS",
    "reasons": [
      "PASS"
    ],
    "expected_candidate_count": 1,
    "observed_candidate_count": 1,
    "matched_candidate_count": 1,
    "accepted_candidate_count": 0,
    "quarantined_candidate_count": 1,
    "complete_unit_count": 1,
    "provider_calls_authorized": 0,
    "workflow_admission_created": false,
    "search_records_created": 0,
    "release_eligible": false,
    "external_effects": "NONE"
  },
  "provider_calls_authorized": 0,
  "workflow_admissions_created": 0,
  "search_records_created": 0,
  "release_eligible": false,
  "external_effects": "NONE"
}
